url,slokenumber,text
https://www.valmikiramayan.net/utf8/ayodhya/sarga38/ayodhyasans38.htm,[],"On seeing Seetha wearing bark of trees like a helpless woman, eventhough protected by her husband all the people there loudly cried out: ""Fie upon you, Dasaratha!"""
https://www.valmikiramayan.net/utf8/ayodhya/sarga38/ayodhyasans38.htm,[],"Pained by that loud cry there, King Dasaratha lost interest in his life, religious merit and esteem."
https://www.valmikiramayan.net/utf8/ayodhya/sarga38/ayodhyasans38.htm,[],"Dasaratha with a warm sigh, spoke to his wife these words. ""Oh, Kaikeyi! Seetha does not deserve to go with a robe made of Kusa grass."""
https://www.valmikiramayan.net/utf8/ayodhya/sarga38/ayodhyasans38.htm,[],"""My preceptro truly says that Seetha, who is delicate young and ever habituated to comforts, is not fit for forest-life"""
https://www.valmikiramayan.net/utf8/ayodhya/sarga38/ayodhyasans38.htm,[],"""has this pitiable daughter of Janaka, the jewel of kings, done any harm to any one that, having obtained a bark of tree she is standing like a hermitess dumbfounded in the midst of men?"""
https://www.valmikiramayan.net/utf8/ayodhya/sarga38/ayodhyasans38.htm,[],"""Seetha the daughter of Janaka need not wear these barks of trees. No such pledge was given be me earlier. hence, let this prinecess go to the forest happily fully provided ewith all valuable possesssions."""
https://www.valmikiramayan.net/utf8/ayodhya/sarga38/ayodhyasans38.htm,[],"""A Cruel pledge has been made on oath by me, who do not deserve to survive. This (providing robes of hermitess to Seetha) has been initiated by you by sheer childishness. That will consume me, as by its own flower to a bamboo."""
https://www.valmikiramayan.net/utf8/ayodhya/sarga38/ayodhyasans38.htm,[],"""Oh evil woman! (Even) supposing a little offence is done by Rama to you, what harm was displayed to you here by Seetha? Oh, mean woman!"""
https://www.valmikiramayan.net/utf8/ayodhya/sarga38/ayodhyasans38.htm,[],"""What harm on earth can be done to you by Seetha, who has blooming eyes like those of a female deer, soft in disposition a practiser of penance?"""
https://www.valmikiramayan.net/utf8/ayodhya/sarga38/ayodhyasans38.htm,[],"""Oh, the evil woman! Sending Rama to exile thus indeed is enough for you. What use is there for you in further doing these wretched, sinful acts too."
https://www.valmikiramayan.net/utf8/ayodhya/sarga38/ayodhyasans38.htm,[],"""Hearing the speech you gave to Rama who came here for coronation, only that much was acceded by me, Oh queen!"""
https://www.valmikiramayan.net/utf8/ayodhya/sarga38/ayodhyasans38.htm,[],"""Transgressing all that, you somehow or other wish to go to hell, by perceiving Seetha also clad in bark of trees."
https://www.valmikiramayan.net/utf8/ayodhya/sarga38/ayodhyasans38.htm,[],"That high-souled king thus lamenting, did not see any ending to that sorrow. Drenched as he was in excessive devotion to his son and having been hurt vey much, he fell down on the ground."
https://www.valmikiramayan.net/utf8/ayodhya/sarga38/ayodhyasans38.htm,[],"Rama, who was setting out to the forest, spoke these words to his father, who was speaking thus bowing down his head, sitting there."
https://www.valmikiramayan.net/utf8/ayodhya/sarga38/ayodhyasans38.htm,[],"""Oh, virtuous king! This glorious Kausalya, my mother is aged. She is not of base nature and will not accuse you."
https://www.valmikiramayan.net/utf8/ayodhya/sarga38/ayodhyasans38.htm,[],"""Oh, the bestower of boons! You are worthy of amply respection her, who is deprived of me, who is immersed in an ocean of sorrow and who has not see such an affliction earlier."""
https://www.valmikiramayan.net/utf8/ayodhya/sarga38/ayodhyasans38.htm,[],"""Having been honoured by you the venerable man, she the pitiable woman will not get such a grief for her son, thinking of me alone and she will draw breath in you."""
https://www.valmikiramayan.net/utf8/ayodhya/sarga38/ayodhyasans38.htm,[],"""Oh, the king akim to the mighty Indra the ruler of gods! You must see that my mother, who has high affection towards her son, will not depart to the house of Yama the God of Death, by abandoning her life being emaciated by grief after my departure for the forest."""
https://www.valmikiramayan.net/utf8/ayodhya/sarga38/ayodhyasans38.htm,[],"Thus completes 38th chapter of ayodhya Kanda in glorious Valmiki Ramayana, the work of a sage and the oldest epic. <h3><a id=""VerseLocator"" name=""VerseLocator""></a>Verse Locator for Book II : Ayodhya Kanda - Book Of Ayodhya : Chapter 38</h3> <center> <table border=""1"" width=""75%""> <tbody> <tr> <td align=""center"" height=""3"" valign=""middle"" width=""20%""><a href=""#PageTop""><font color=""#0000FF"" face=""Times New Roman"" size=""4"">Top of Page</font></a></td> <td align=""center"" height=""3"" valign=""middle"" width=""20%""><a href=""#Verse1""><font color=""#0000FF"" face=""Times New Roman"" size=""4"">1</font></a></td> <td align=""center"" height=""3"" valign=""middle"" width=""20%""><a href=""#Verse2""><font color=""#0000FF"" face=""Times New Roman"" size=""4"">2</font></a></td> <td align=""center"" height=""3"" valign=""middle"" width=""20%""><a href=""#Verse3""><font color=""#0000FF"" face=""Times New Roman"" size=""4"">3</font></a></td> <td align=""center"" height=""3"" valign=""middle"" width=""20%""><a href=""#Verse4""><font color=""#0000FF"" face=""Times New Roman"" size=""4"">4</font></a></td> </tr> <tr> <td align=""center"" height=""3"" valign=""middle"" width=""20%""><a href=""#Verse5""><font color=""#0000FF"" face=""Times New Roman"" size=""4"">5</font></a></td> <td align=""center"" height=""3"" valign=""middle"" width=""20%""><a href=""#Verse6""><font color=""#0000FF"" face=""Times New Roman"" size=""4"">6</font></a></td> <td align=""center"" height=""3"" valign=""middle"" width=""20%""><a href=""#Verse7""><font color=""#0000FF"" face=""Times New Roman"" size=""4"">7</font></a></td> <td align=""center"" height=""3"" valign=""middle"" width=""20%""><a href=""#Verse8""><font color=""#0000FF"" face=""Times New Roman"" size=""4"">8</font></a></td> <td align=""center"" height=""3"" valign=""middle"" width=""20%""><a href=""#Verse9""><font color=""#0000FF"" face=""Times New Roman"" size=""4"">9</font></a></td> </tr> <tr> <td align=""center"" height=""3"" valign=""middle"" width=""20%""><a href=""#Verse10""><font color=""#0000FF"" face=""Times New Roman"" size=""4"">10</font></a></td> <td align=""center"" height=""3"" valign=""middle"" width=""20%""><a href=""#Verse11""><font color=""#0000FF"" face=""Times New Roman"" size=""4"">11</font></a></td> <td align=""center"" height=""3"" valign=""middle"" width=""20%""><a href=""#Verse12""><font color=""#0000FF"" face=""Times New Roman"" size=""4"">12</font></a></td> <td align=""center"" height=""3"" valign=""middle"" width=""20%""><a href=""#Verse13""><font color=""#0000FF"" face=""Times New Roman"" size=""4"">13</font></a></td> <td align=""center"" height=""3"" valign=""middle"" width=""20%""><a href=""#Verse14""><font color=""#0000FF"" face=""Times New Roman"" size=""4"">14</font></a></td> </tr> <tr> <td align=""center"" height=""3"" valign=""middle"" width=""20%""><a href=""#Verse15""><font color=""#0000FF"" face=""Times New Roman"" size=""4"">15</font></a></td> <td align=""center"" height=""3"" valign=""middle"" width=""20%""><a href=""#Verse16""><font color=""#0000FF"" face=""Times New Roman"" size=""4"">16</font></a></td> <td align=""center"" height=""3"" valign=""middle"" width=""20%""><a href=""#Verse17""><font color=""#0000FF"" face=""Times New Roman"" size=""4"">17</font></a></td> <td align=""center"" height=""3"" valign=""middle"" width=""20%""><a href=""#Verse18""><font color=""#0000FF"" face=""Times New Roman"" size=""4"">18</font></a></td> </tr> </tbody> </table> </center>   <!-- GoFTP Free Version Start --> <p>  <p>     <a href=""http://www.answeranimal.com"" style=""font-size:x-small; text-decoration:none; color:#CCCCCC;"">                Check here for      who and            further information concerning      verse      </a><br> <a href=""http://www.goftp.com"" style=""font-size:x-small; text-decoration:none; color:#CCCCCC;"">                         powered by             Go FTP FREE        Software </a></br>  <!-- GoFTP Free Version End -->"
